Teaser,Date
Remis im EM-Duell mit England: Punktsieger Schottland,
Copa América trotz Pandemie: Coronainfizierter Fußballer für Kritik am Verband gesperrt,
Dokumentarfilm über erste Konzentrationslager 1933: »Für Stottern fünf Schläge. Für Schweigen 15«,
Nachwahl zum britischen Unterhaus: Überraschende Wahlniederlage für Tories,
Katholische Kirche in den USA: Große Mehrheit der Bischöfe gegen Kommunion für Biden,
Warum Audi gerade jetzt das Ende der Verbrenner verkündet,
Innenministerium warnt vor russischer Propaganda-Attacke auf Baerbock,
Große Mehrheit der Bischöfe gegen Kommunion für Biden,
Was die Verbreitung der Delta-Variante für Kinder bedeutet,
Panne in bayerischen Testzentren – Personendaten online einsehbar,
»Wir machen die gleichen Fehler noch einmal«,
Punktsieger Schottland,
Christian Eriksen aus Krankenhaus entlassen,
Überraschende Wahlniederlage für Tories,
Frauke Petrys vergiftetes Abschiedsgeschenk,
So will sich EY nach dem Wirecard-Desaster vor dem Abgrund retten,
Die Erde speichert fast doppelt so viel Wärme wie 2005,
Wie die Hitze den Westen der USA austrocknet,
Die Wunderwaffen für ein gesundes Leben,
"Skifahren im Hochsommer, mitten in Deutschland",
»Für Stottern fünf Schläge. Für Schweigen 15«,
"»Wie viele Deutsche braucht man, um eine Glühbirne zu wechseln?«",
Coronainfizierter Fußballer für Kritik am Verband gesperrt,
Ist Querdenker Joshiko Saibou wirklich geläutert?,
Nowitzki kehrt zu den Dallas Mavericks zurück,
Das Curevac-Debakel,
Leiden Sie auch an »Homeoffice-Rücken«?,
"Sie nannte ihn Bibi, er nannte sie Mausi",
Der Schmerzensmann,
Lebensgefährliche Selbstüberschätzung,
Propaganda für die Welt von vorgestern,
"Vorsicht, Propaganda!",
Und jetzt schluck!,
Audi gibt neuen Benzin-Autos noch fünf Jahre,
In diesen Städten ist die Luft am besten,
Warum ein 650.000 Jahre alter Permafrostboden abschmilzt,
Umsturz im Gerichtssaal – wie Prozesse die Klimapolitik durcheinanderbringen,
AfD-Spitzenkandidat: Chrupalla als Redner bei Konferenz des russischen Verteidigungsministeriums,
Landtagswahl in Mecklenburg-Vorpommern: SPD wählt Manuela Schwesig zur Spitzenkandidatin,
Noch 100 Tage bis zur Bundestagswahl: Was diesmal anders ist – und was besonders,
Pressekonferenz: Angela Merkel trifft Emmanuel Macron,
Türkei: Polizist wegen Todes von jüngstem Gezi-Opfer verurteilt,
Vereinte Nationen: Guterres bleibt für eine weitere Amtszeit Uno-Generalsekretär,
Italien: Lkw durchbricht Streikposten und tötet Gewerkschaftsführer,
Flüchtlingsboot gekentert: Unglück vor Lanzarote – Tote und Vermisste,
Fußball-EM: Elefanten-Orakel prophezeit deutschen Erfolg gegen Portugal,
Remis gegen Schottland bei der Fußball-EM: Harmlose Engländer enttäuschen im Prestigeduell,
"Kroatien und Tschechien spielen remis bei Fußball-EM: Schick trifft mit blutiger Nase, Perišić ins lange Eck",
Pressekonferenz: Das sagen Jogi Löw und Joshua Kimmich vor dem Spiel gegen Portugal,
Urteil gegen AstraZeneca: EU bekommt 50 Millionen Impfstoffdosen,
Wegen Lackablösung: Firma ruft Pizza-Dosentomaten zurück,
»Da sind wir dran«: Lufthansa will Corona-Milliardenhilfe noch vor Bundestagswahl zurückzahlen,
Impfstoff gegen Corona: Wie Curevac eine Jahrhundertchance verspielt,
Steuermilliarden für Elektroautos: Wie die Autoindustrie bei der Mobilitätswende abkassiert,
Inside-Report: Die Aufstiegsformel der Topmanagerinnen,
Havarie der »X-Press Pearl«: Die Umweltkatastrophe von Sri Lanka,
SPIEGEL-Klimabericht: Die Hitze ist politisch,
Coronavirus – die Woche: Warum Sie jetzt das Problem von Curevac sind,
Schwache Verschlüsselung: Forscher entdecken mutmaßliche Hintertür im 2G-Mobilfunk,
Wahlkampf: Desinformation im Netz nimmt zu,
Virales Video nicht entfernt: Polizei bestellt Indiens Twitter-Chef ein,
Versabbelter »Polizeiruf« aus München: Dann lieber 20 Minuten »Big Bang Theory«,
Album der Woche mit H.E.R.: Wenn die Gitarre zu sanft seufzt,
»Wie ein Stück Fleisch behandelt«: Scarlett Johansson kritisiert Sexismus in Marvel-Filmen,
Arbeitsrecht bei Sommerwetter: Muss ich trotz dieser Hitze mit FFP2-Maske arbeiten?,
Tränen im Job: Diese Sätze sollten Sie sich sparen,
"Personalmangel in der Gastronomie: Tischlein, deck dich doch selbst",
"Berufseinstieg als Medizinphysiker: »Abends muss ich meine Hände und Füße abchecken, damit ich keine Strahlung nach draußen trage«",
"Auslandsaufenthalt im Studium: Warum es manchmal besser ist, zu Hause zu bleiben",
Anwältinnen über Gleichberechtigung: »Der weiße Cis-Mann kann auch zu allen anderen Kanzleien gehen«,
Eisberg-Entführungen: Ein gigantisches Wassereis für die Wüste,
Zeitreise - Der SPIEGEL vor 50 Jahren: Schmählichster Skandal,
"Blick in die eigene Stasiakte: »Ach nee, die ganze Post an meine Mutti«",
Autogramm: Ford Mustang Mach 1: Very Heavy Metal,
SPIEGEL-Auswertung zum Carsharing: Wo die schöne Welt der neuen Mobilität endet,
"Erste Fahrt im neuen Opel Astra: Nimm dies, Volkswagen",
»Jemand wollte einen täglichen Videocall mit seinem Hund«,
In diesem Jahr sollten wir Eltern die Zeugnisse schreiben,
Neue Verhütungspille mit unklarem Thromboserisiko,
Zur EM gibt es Spareribs,
Raus aus der vollen Stadt – ab ins Grüne,
"Schläuche, die sich selbst aufrollen",
Regenmacher,
Den Wald umarmen,
"An die Stifte, fertig, los!",
Mehr als nur Wasser und Sand,
"Nur wer wählt, der zählt?",
»Ich zweifle nicht an mir selbst«,
Anzeige: Wöchentliche Chance auf einen Gewinn: Glück kann so einfach sein!,
Anzeige: DA Direkt Zahnzusatzversicherung: das kann der Testsieger,
Anzeige: Rindfleisch grillen: nachhaltig und lecker direkt vom Bauern,
Cartoon des Tages,
Er hat an der Uhr gedreht,
Wegen baldigen Ablaufdatums: Palästinenser sagen Impfdosen-Tausch mit Israel ab,
Palästinenser sagen Impfdosen-Tausch mit Israel ab,
"Wie uns neue Supermedizin vor Krebs, Demenz und Herzinfarkt retten soll",
Der schwarze Donnerstag in Aschheim,
Bei seinen Nachbarn hat Olaf Scholz schon verloren,
»Mit Intensivmedizin kann man sehr viel Geld verdienen«,
"»Das zweite Kind ist oft der Knackpunkt, der zu einer Trennung führt«",
"SPIEGEL Daily Podcast: Die Woche: Mord ohne Sühne, Konzerne ohne Anstand, Delta-Variante mit Auswirkungen",
+++ Corona-News +++: Sieben-Tage-Inzidenz erstmals seit neun Monaten einstellig,
Emissionen in der Schifffahrt: So scheitert die Welt am Klimaschutz auf hoher See,
Sieben-Tage-Inzidenz erstmals seit neun Monaten einstellig,
So scheitert die Welt am Klimaschutz auf hoher See,
Wachleute prügelten Joao Alberto Freitas zu Tode – weil er schwarz war?,
Wie die Uefa ihre Corona-EM durchpeitscht,
Angeblich an Raststätte gefunden: Mann liefert wertvolle Ölgemälde bei der Polizei ab,
Die Linke an ihrem Parteitag: »Alle wollen immer absolut recht haben«,
Die Bestmarke hielt mehr als 30 Jahre: US-Leichtathlet Crouser stößt Weltrekord,
"Französischer Filmstar Eva Green: »Johnny Depp ist ein Gentleman, ich würde ihn jederzeit verteidigen«",
»Delta-Variante einfach zu gefährlich«: Lauterbach hält EM-Spiele in Großbritannien für unvertretbar,
Verstöße gegen Corona-Regeln: Polizei räumt Party von 3000 Menschen im Hamburger Stadtpark,
Lauterbach hält EM-Spiele in Großbritannien für unvertretbar,
Polizei räumt Party von 3000 Menschen im Hamburger Stadtpark,
US-Leichtathlet Crouser stößt Weltrekord,
"»Johnny Depp ist ein Gentleman, ich würde ihn jederzeit verteidigen«",
Die Lage am Morgen: Wem gefällt die Anti-Baerbock-Anzeige?,
"Coronadesaster in Afrika: Das passiert, wenn die Delta-Variante auf eine ungeimpfte Bevölkerung trifft",
Nach Start in Sibirien: Flugzeug mit Fallschirmspringern abgestürzt – Vier Tote,
"Das passiert, wenn die Delta-Variante auf eine ungeimpfte Bevölkerung trifft",
Wem gefällt die Anti-Baerbock-Anzeige?,
Spaltet die grüne Elite die Gesellschaft?,
»Alle wollen immer absolut recht haben«,
Flugzeug mit Fallschirmspringern abgestürzt – Vier Tote,
Ex-AfD-Chefin stellt Buch vor: Frauke Petrys vergiftetes Abschiedsgeschenk,
In beratender Rolle: Nowitzki kehrt zu den Dallas Mavericks zurück,
Polizei räumt Party von 4000 Menschen im Hamburger Stadtpark,
Hardliner Ebrahim Raisi wird neuer Präsident in Iran,
Problematisches Puzzle für Southgate,
Lochte verpasst Qualifikation für fünfte Spiele,
Kalkulierte E-Offensive: Warum Audi gerade jetzt das Ende der Verbrenner verkündet,
Bedford-Strom fordert Sonder-Obulus von Vermögenden,
Intel-Managerin fordert staatliche Hilfen für Chip-Produktion,
Besonderes Gemälde von Onassis' Superjacht kommt unter den Hammer,
"Wintersporthalle wiedereröffnet: Skifahren im Hochsommer, mitten in Deutschland",
Mehr als 50 Grad Celsius: Wie die Hitze den Westen der USA austrocknet,
Bedford-Strohm fordert Sonder-Obulus von Vermögenden,
Computer-Trouble legt Hubble lahm,
Wetternotlage im Westen der USA: »Es ist eine apokalyptische Atmosphäre mit dieser Rekordhitze«,
Ernährung: Mit Kitkat die Welt retten,
Sinkende Corona-Zahlen: ARD-Talkshows wieder mit Publikum? Vielleicht nach der Sommerpause,
Zoff um Weinproduktion: Australien zitiert China vor ein WTO-Gericht,
Weltraumteleskop im Notmodus: Computer-Trouble legt »Hubble« lahm,
Australien zitiert China vor ein WTO-Gericht,
»Es ist eine apokalyptische Atmosphäre mit dieser Rekordhitze«,
Computer-Trouble legt »Hubble« lahm,
ARD-Talkshows wieder mit Publikum? Vielleicht nach der Sommerpause,
Wettbewerb der Sponsoren: Die EM der Marketing-Milliarden,
Energiebilanz des Planeten: Die Erde speichert fast doppelt so viel Wärme wie 2005,
"Betroffene von Anti-LGBTQ-Gesetz in Ungarn: »Früher waren es die Flüchtlinge, dann die Roma, nun ist die LGBTQ-Community dran«",
Sinkende Coronazahlen: ARD-Talkshows wieder mit Publikum? Vielleicht nach der Sommerpause,
"»Früher waren es die Flüchtlinge, dann die Roma, nun ist die LGBTQ-Community dran«",
Retsina muss keine griechische Tragödie sein,
Hongkong: Wildschwein fährt U-Bahn,
"»Was das russische Militär übt, ist beängstigend«",
Erneut Höchstwert bei Corona-Infektionen in Moskau,
Wildschwein fährt U-Bahn,
Die Hitze ist politisch,
Nach Start in Sibirien: Flugzeug mit Fallschirmspringern abgestürzt – vier Tote,
US-Schwimmstar: Lochte verpasst Qualifikation für fünfte Spiele,
Olympische Spiele in Japan: Tokio streicht Public Viewing,
Hitzewelle in Deutschland: Hohe Waldbrandgefahr und drohende Unwetter,
"Deutschland gegen Portugal: Berti, Sergej und der Sommer der Einheit",
Virtuelle Welten: Wie viel Politik passt in ein Videospiel?,
Niedrigzinsen: So legen Sie Ihr Erspartes gut und sicher an,
Erneut Höchstwert bei Coronainfektionen in Moskau,
DIW-Chef Fratzscher fordert Ladenöffnungen am Sonntag,
Parteichefin Wissler lehnt Uno-Friedensmissionen weiterhin ab,
"Berti, Sergej und der Sommer der Einheit",
So legen Sie Ihr Erspartes gut und sicher an,
"»Ich bin geworden, wovon ich als Junge träumte: Kapitän auf eigenem Schiff«",
Wie viel Politik passt in ein Videospiel?,
Eriksen besucht seine Mitspieler: »Gefühl von Liebe und Freude«,
Bahn rechnet mit Ferienboom,
Tokio streicht Public Viewing,
Die Fans der Gendersprache müssen Argumente liefern,
Hohe Waldbrandgefahr und drohende Unwetter,
"Das lesen Armin Laschet, Annalena Baerbock und Olaf Scholz in diesem Sommer",
Verstöße gegen Coronaregeln: Polizei räumt Party von 4000 Menschen im Hamburger Stadtpark,
Unglück in Belgien: Schulneubau in Antwerpen eingestürzt – mindestens zwei Tote,
Mögliche Aufstellungen gegen Portugal: Warum Löw Veränderungen so scheut,
Entmachtete Regierungschefin Myanmars: Anhängerinnen von Aung San Suu Kyi protestieren mit Blumen,
Anhängerinnen von Aung San Suu Kyi protestieren mit Blumen,
»Mit den beiden Juden-Mädchen bist Du ja gerade nicht sehr sanft umgegangen«,
Warum Löw Veränderungen so scheut,
»Gefühl von Liebe und Freude«,
Schulneubau in Antwerpen eingestürzt – mindestens zwei Tote,
Remis gegen Schottland: Problematisches Puzzle für Southgate,
Einzelhändler in der Coronakrise: DIW-Chef Fratzscher fordert Ladenöffnungen am Sonntag,
"Aussteiger in Malaysia: »Ich bin geworden, wovon ich als Junge träumte: Kapitän auf eigenem Schiff«",
Giffeys Gegner bei Berlin-Wahl: CDU nominiert Kai Wegner als Spitzenkandidaten,
Schottische Fans bei der EM London: Wenn Prestige mehr zählt als die Angst vor Corona,
Spahn will Coronamaßnahmen an Schulen verlängern,
CDU nominiert Kai Wegner als Spitzenkandidaten,
Wenn Prestige mehr zählt als die Angst vor Corona,
Debatte über Wahlprogramm der Linken: Parteichefin Wissler lehnt Uno-Friedensmissionen weiterhin ab,
Wettbewerb der Sponsoren: Deutschland - das teuerste Nationalteam der Welt,
Kleines Land mit vielen Ausnahmespielern: Die Kaderschmieden von Lissabon,
»Extreme und unentschuldbare Gewalt«: Polizeieinsatz gegen illegalen Rave in der Bretagne eskaliert dramatisch,
Privacy-Umfrage: Große Mehrheit nutzt WhatsApp trotz Datenschutzdebatte weiter,
Sebastian Kurz und der Sumpf von Wien,
Die Kaderschmieden von Lissabon,
Große Mehrheit nutzt WhatsApp trotz Datenschutzdebatte weiter,
Polizeieinsatz gegen illegalen Rave in der Bretagne eskaliert dramatisch,
Er war der König des Britpop – das hätte ihn fast umgebracht,
Churchill als Maler: Besonderes Gemälde aus Onassis' Superjacht kommt unter den Hammer,
Mangelware Halbleiter: Intel-Managerin fordert staatliche Hilfen für Chip-Produktion,
"Kryptowährungen unter Druck: Bitcoin stürzt erneut, Cyberattacken nehmen zu",
Ungarns Regierungschef: Orbán will EU-Parlament entmachten,
#MeToo im Deutschrap: Frau wirft Samra Vergewaltigung vor – Rapper bestreitet,
Schleswig-Holstein: Taucher und Spezialhunde suchen in See nach vermisstem Mädchen,
Wahlsieger in Iran: Raisi – eiserner Verteidiger der Reaktionäre,
Künstliche Intelligenz: Warum sollte die KI uns ausrotten? Aus Langeweile?,
Fußballguckmüdigkeit: Es ist EM – und keinen interessiert's,
Raisi – eiserner Verteidiger der Reaktionäre,
Söder hält Delta-Variante in vier Wochen für dominierend in Deutschland,
Countdown zur deutschen Partie gegen Portugal,
Es ist EM – und keinen interessiert's,
Orbán will EU-Parlament entmachten,
Frau wirft Samra Vergewaltigung vor – Rapper bestreitet,
Taucher und Spezialhunde suchen in See nach vermisstem Mädchen,
Extrem niedrige Wahlbeteiligung: Hardliner Ebrahim Raisi wird neuer Präsident in Iran,
Basketball: FC Bayern wird fester Teil der EuroLeague,
Muslimische Gruppierung unter Beobachtung: Die Islamisten-Hipster,
Die Islamisten-Hipster,
Warum sollte die KI uns ausrotten? Aus Langeweile?,
FC Bayern wird fester Teil der EuroLeague,
"Kursrutsch der Kryptowährung: Bitcoin stürzt erneut, Cyberattacken nehmen zu",
Protesttanz,
Weltmeister Frankreich spielt nur 1:1 bei der Fußball-EM: Griezmann verhindert eine ungarische Sensation,
Früherer französischer Außenminister: Papst will EU-Vordenker Robert Schuman seligsprechen,
Sibirien: Abkühlung? Ab auf den Gletscher!,
Keine Änderungen gegen Portugal – Löw vertraut der Frankreich-Startelf,
Papst will EU-Vordenker Robert Schuman seligsprechen,
Abkühlung? Ab auf den Gletscher!,
"Klagen, Millionenverluste, Mitarbeiterflucht: So will sich EY nach dem Wirecard-Desaster vor dem Abgrund retten",
Krise der Verbände: Das deutsche Sportsystem ist gescheitert,
"Versteigerung in Paris: 2,9 Millionen Euro für eine Mona-Lisa-Kopie",
Grand Prix in Le Castellet: Verstappen startet in Frankreich von der Poleposition,
Hitzewelle: Deutschland sucht Abkühlung,
Weltmeister Frankreich spielt nur 1:1 bei der Fußball-EM: Griezmann verhindert ungarische Sensation,
Griezmann verhindert ungarische Sensation,
»Viele sind hilfloser denn je«,
Mit Kitkat die Welt retten,
Deutschland sucht Abkühlung,
Verstappen startet in Frankreich von der Poleposition,
Das deutsche Sportsystem ist gescheitert,
"2,9 Millionen Euro für eine Mona-Lisa-Kopie",
Maskenpflicht und Wechselunterricht: Spahn will Coronamaßnahmen an Schulen verlängern,
Nach Hofer-Rücktritt: Herbert Kickl neuer Parteichef der FPÖ in Österreich,
Weitspringerin Malaika Mihambo: »Olympia – das ist mein nächstes Ziel«,
Die DFB-Elf unter Druck – gelingt gegen Portugal die Wende?,
Herbert Kickl neuer Parteichef der FPÖ in Österreich,
Delta-Variante in Dresdner Wohnhaus – 150 Menschen müssen zum Test,
»Olympia – das ist mein nächstes Ziel«,
Post von Augstein: Putins wahres Gesicht,
Spiel Deutschland gegen Ungarn: München will EM-Stadion in Regenbogenfarben,
Krankheitsängste: Ist das wirklich nur eine Erkältung?,
»Ich werde ihn vermissen«: US-Präsident Biden trauert um Familienhund Champ,
"Portugal führt, wie antwortet die deutsche Mannschaft?",
US-Präsident Biden trauert um Familienhund Champ,
Ist das wirklich nur eine Erkältung?,
Putins wahres Gesicht,
Medienbericht über Gremiumssitzung: Kardinal Woelki erntet heftige Kritik von eigenen Beratern,
"Außenseiter Ungarn spielt 1:1 gegen Frankreich: Ein Unentschieden, gefeiert wie ein Sieg",
Zwei Eigentore von Portugal – DFB-Elf geht mit Führung in die Pause,
"Ein Unentschieden, gefeiert wie ein Sieg",
München will EM-Stadion in Regenbogenfarben,
A20 in Mecklenburg-Vorpommern: Radfahrer wollte auf Autobahn-Standstreifen nach Polen,
"Gosens überragend, Deutschland klar in Führung",
Radfahrer wollte auf Autobahn-Standstreifen nach Polen,
Vier Tore gegen Portugal – Deutschland kommt dem Achtelfinale näher,
Wie Deutschland gegen Portugal gewonnen hat,
Regionalwahlen als Stimmungstest für Macron: Kippt Frankreich nach rechts?,
Kippt Frankreich nach rechts?,
"Portugal in der Einzelkritik: Vierfach getroffen, aber nur zweimal ins richtige Tor",
Parteitag: Linken-Führung beschwört Geschlossenheit,
"Vierfach getroffen, aber nur zweimal ins richtige Tor",
Linken-Führung beschwört Geschlossenheit,
Türkei: Frauen demonstrieren in Istanbul für ihre Rechte,
"Deutschland in der Einzelkritik: Kimmich wächst in die Rolle, die er nicht mag",
"Kimmich wächst in die Rolle, die er nicht mag",
Frauen demonstrieren in Istanbul für ihre Rechte,
Reaktionen zum 4:2-Sieg der Fußball-Nationalmannschaft: »Dann kocht der Kessel«,
Corona in Russland: Jetzt kommt die Impfpflicht,
Deutscher Sieg gegen Europameister Portugal bei der EM: Ein kleines Sommermärchen,
Ein kleines Sommermärchen,
»Dann kocht der Kessel«,
Nach Sieg gegen Portugal: Deutschlands Wege ins Achtelfinale – und welche Gegner dort warten könnten,
So gewinnt man verlorene Fans zurück,
Jetzt kommt die Impfpflicht,
Unentschieden gegen Spanien bei Fußball-EM 2021: Lewandowski hält Polen im Turnier,
Ebrahim Raisi wird Präsident: Stunde der Wahrheit für Irans Hardliner,
Ohne Masken im Stadion – Bayern Gesundheitsminister kritisiert Fans,
Stunde der Wahrheit für Irans Hardliner,
Seen und Flüsse in Deutschland: Viele Badeunfälle am Hitzewochenende,
Deutsche Nationalmannschaft bei der EM: So gewinnt man verlorene Fans zurück,
Lewandowski hält Polen im Turnier,
"Grüne und FDP sind sich näher, als sie denken",
Grüne und FDP sind sich näher als sie denken,
Viele Badeunfälle am Hitzewochenende,
Deutschlands Wege ins Achtelfinale – und welche Gegner dort warten könnten,
Fußball-EM 2021: Vier Tore gegen Portugal – Deutschland kommt dem Achtelfinale näher,
Reaktionen auf Wahl in Iran: Wie geht es weiter mit dem Atomabkommen?,
Wie geht es weiter mit dem Atomabkommen?,
"+++ Corona-News +++: Sieben-Tage-Inzidenz sinkt weiter auf 8,8",
"Sieben-Tage-Inzidenz sinkt weiter auf 8,8",
So schützen Sie sich auf Reisen vor Corona,
+++ Corona-News +++: Ohne Masken im Stadion – Bayern Gesundheitsminister kritisiert Fans,
Debatte über Wahlprogramm der Union: Volker Bouffier hält höhere Mütterrente für nicht finanzierbar,
Geruchsstörung nach Covid-19: Wenn der Kaffee plötzlich wie Benzin riecht,
Mehr als 500.000 Tote: Zehntausende Brasilianer demonstrieren gegen Bolsonaros Corona-Politik,
Zehntausende Brasilianer demonstrieren gegen Bolsonaros Corona-Politik,
Wenn der Kaffee plötzlich wie Benzin riecht,
Volker Bouffier hält höhere Mütterrente für nicht finanzierbar,
Coronapandemie: Regierung will FFP2-Masken in Kindergrößen,
Überraschendes Remis in Ungarn: Warum Frankreich jetzt genau so weitermachen sollte,
DFB-Matchwinner Gosens: Er berührt die Herzen,
Regierung will FFP2-Masken in Kindergrößen,
Er berührt die Herzen,
Warum Frankreich jetzt genau so weitermachen sollte,
Kochen mit Kindern: Bücher für kleine Kochmützen,
Extremtemperaturen im Death Valley: 59° Celsius im Juni,
Unterstützung bei Uno-Mission Minusma: Bundeswehr schickt Transporthubschrauber nach Mali,
Wir drehen eine Runde: Campingbus Kompanja: Dieser Van kann vieles besser als der VW California,
Zehntausende Brasilianer demonstrieren gegen Bolsonaros Coronapolitik,
Bundeswehr schickt Transporthubschrauber nach Mali,
59° Celsius im Juni,
Bücher für kleine Kochmützen,
Dieser Van kann vieles besser als der VW California,
Unwetterwarnung des Wetterdienstes: Gewitterfront bringt Starkregen – eine Kaltfront folgt,
Seit Missbrauchsstudie 2018: Hunderte neue Hinweise auf sexuelle Übergriffe in katholischer Kirche,
Abrechnung mit Boris Johnson: Ex-Parlamentspräsident Bercow wechselt zur Labour-Partei,
Hunderte neue Hinweise auf sexuelle Übergriffe in katholischer Kirche,
Im Schatten der Glitzershow herrschen Angst und Gewalt,
Ex-Parlamentspräsident Bercow wechselt zur Labour-Partei,
Gewitterfront bringt Starkregen – eine Kaltfront folgt,
Bei Fort Lauderdale: Lieferwagen fährt in Teilnehmer einer LGBT-Parade – ein Toter,
Die Stunde der Arbeiter: Wie sich US-Firmen um neue Mitarbeiter reißen,
Abrechnung mit Boris Johnson: Ex-Parlamentspräsident Bercow wechselt zur Labourpartei,
Wie sich US-Firmen um neue Mitarbeiter reißen,
Die Neue Rechte ist vollkommen verwirrt,
»Wir haben die Tür zu einer neuen Welt von Arzneimitteln geöffnet«,
Ex-Parlamentspräsident Bercow wechselt zur Labourpartei,
Lieferwagen fährt in Teilnehmer einer LGBT-Parade – ein Toter,
Armut: Staat gibt immer mehr Geld für Sozialleistungen aus,
Konzentrationstipps im Selbstversuch: Hilft Fanta gegen Prokrastination?,
China knackt die Milliarden-Marke bei Corona-Impfungen,
Staat gibt immer mehr Geld für Sozialleistungen aus,
54° Celsius im Juni,
Hilft Fanta gegen Prokrastination?,
»Star Wars«-Ruhm – und nun?,
"SPIEGEL-Taktiktafel zum EM-Sieg gegen Portugal: Das 20-Sekundentor, das zeigt, wie der Plan mit Kimmich und Gosens aufging",
Union und SPD einigen sich: Hamas-Flagge soll offenbar verboten werden,
Olympische Spiele in Japan: Trotz Impfung – erster Coronafall unter einreisenden Athleten,
Statistik-Auswertung: Zahl der Autos in den Städten wächst weiter,
Trotz Impfung – erster Coronafall unter einreisenden Athleten,
Hamas-Flagge soll offenbar verboten werden,
Zahl der Autos in den Städten wächst weiter,
"Das 20-Sekundentor, das zeigt, wie der Plan mit Kimmich und Gosens aufging",
Pressestimmen zum Sieg der DFB-Elf: »Ronaldo muss sich in Demut üben«,
Cartoons der Woche: Krank oder Spaßbremse?,
Testlauf in Nordrhein-Westfalen: Das Schulzeugnis der Zukunft ist digital,
Das Schulzeugnis der Zukunft ist digital,
Trotz Hitzewelle: Extremsportlerin Steffi Saul beendet 250-Kilometer-Spendenlauf,2021-06-20
Deutsch-österreichische Autorin: Nava Ebrahimi gewinnt Bachmannpreis,2021-06-20
Rassismusvorwürfe gegen Enid Blyton: Kinderbücher wurden schon immer aufgeräumt,2021-06-20
China knackt die Milliardenmarke bei Coronaimpfungen,2021-06-20
"Armin Laschet, deutscher Buddha",2021-06-20
»Ronaldo muss sich in Demut üben«,2021-06-20
Extremsportlerin Steffi Saul beendet 250-Kilometer-Spendenlauf,2021-06-20
Kinderbücher wurden schon immer aufgeräumt,2021-06-20
Nava Ebrahimi gewinnt Bachmannpreis,2021-06-20
Extremtemperaturen im Death Valley: 54° Celsius im Juni,2021-06-20
Nach Präsidentenwahl: Verhandlungen um Atomabkommen mit Iran gehen weiter,2021-06-20
»Absurder Einfall«: Scholz lehnt Steuererleichterungen für Unternehmen ab,2021-06-20
Experiment in Norwegen: Norwegische Forscher wollen Wale zum Wohl der Wale fangen,2021-06-20
Scholz lehnt Steuererleichterungen für Unternehmen ab,2021-06-20
Norwegische Forscher wollen Wale zum Wohl der Wale fangen,2021-06-20
Fußball-EM: Warum die einstige Fußballweltmacht Spanien zu scheitern droht,2021-06-20
Deutsche Nationalelf bei der EM: Ab jetzt darf geträumt werden,2021-06-20
Nach Präsidentenwahl: Verhandlungen über Atomabkommen mit Iran gehen weiter,2021-06-20
Wenn der Sohn zum Problemfall wird,2021-06-20
Deutschland hat bereits mehr als 22 Millionen digitale Impfpässe ausgestellt,2021-06-20
Ab jetzt darf geträumt werden,2021-06-20
Warum Luis Enrique zu scheitern droht,2021-06-20
Mordauftrag im Darknet: »Muss wie ein Unfall aussehen«,2021-06-20
Atomabkommen: Iran sitzt wieder am Verhandlungstisch,2021-06-20
Iran sitzt wieder am Verhandlungstisch,2021-06-20
Unwetter in Flandern: Kleiner Tornado fegt durch belgische Provinz,2021-06-20
Nordrhein-Westfalen: Mann randaliert mit Bagger,2021-06-20
So lenkt Erdoğan den türkischen Fußball,2021-06-20
"Das 20-Sekunden-Tor, das zeigt, wie der Plan mit Kimmich und Gosens aufging",2021-06-20
»Muss wie ein Unfall aussehen«,2021-06-20
Kleiner Tornado fegt durch belgische Provinz,2021-06-20
Mann randaliert mit Bagger,2021-06-20
Onlineparteitag: Linke zieht mit Forderung nach Garantie-Einkommen in den Wahlkampf,2021-06-20
Tennisturnier in Halle: Doppelspezialist Krawietz mit erstem Sieg auf Rasen,2021-06-20
Medaillenhoffnung für Tokio: Kanutin Herzog gewinnt Gold bei der Generalprobe für Olympia,2021-06-20
Unwetter: Tornados fegen durch Orte in Belgien und Frankreich,2021-06-20
Linke zieht mit Forderung nach Garantie-Einkommen in den Wahlkampf,2021-06-20
Warum die einstige Fußballweltmacht Spanien zu scheitern droht,2021-06-20
Kanutin Herzog gewinnt Gold bei der Generalprobe für Olympia,2021-06-20
Tornados fegen durch Orte in Belgien und Frankreich,2021-06-20
