Teaser,Date
Trump startet seine Rache-Tour,2021-06-21
"RKI meldet 455 Neuinfektionen, Sieben-Tage-Inzidenz sinkt",2021-06-21
Sie kennen mich,2021-06-21
Klimaschutz: Wie sinnvoll ist die CO₂-Entfernung aus der Atmosphäre?,2021-06-21
SPIEGEL Daily Podcast: Brasilien: Warum schenkt die Stadt Maricá ihren Bürgern Geld?,2021-06-21
Darf man noch »indische Variante« sagen?,2021-06-21
Wahlprogramm der Union: Warum CDU und CSU keine Klimaschutzparteien sind,2021-06-21
Australien: Mäuse beschädigen Gefängnis – Hunderte Häftlinge werden verlegt,2021-06-21
Trump wollte infizierte US-Bürger offenbar nach Guantánamo schicken,2021-06-21
Warum CDU und CSU keine Klimaschutzparteien sind,2021-06-21
Mäuse beschädigen Gefängnis – Hunderte Häftlinge werden verlegt,2021-06-21
Türkischer »Batman«: Jeden Tag mit dem Wingsuit nach Hause,2021-06-21
Big Sur in Kalifornien: Waldbrände bedrohen seltene Arten an US-Westküste,2021-06-21
Onlinehändler: Amazon setzt auf selbstfahrende Lastwagen,2021-06-21
Trump startet seine Rachetour,2021-06-21
Baerbock kritisiert Grünenliste im Saarland,2021-06-21
Markus Braun: Der Gierige,2021-06-21
CSU-Forderung: Junge Union sieht wenig Möglichkeiten bei Aufstockung der Mütterrente,2021-06-21
Ausbreitung von Delta-Variante: So könnte sich Deutschland gegen die vierte Welle wappnen,2021-06-21
Noch vor der Geburt: Harry und Meghan sicherten sich mehrere Domains für Tochter Lilibet Diana,2021-06-21
Solidarität aus der Bundesliga: Köln und Frankfurt wollen Stadien in Regenbogenfarben strahlen lassen,2021-06-21
So könnte sich Deutschland gegen die vierte Welle wappnen,2021-06-21
Köln und Frankfurt wollen Stadien in Regenbogenfarben strahlen lassen,2021-06-21
Statement aus Budapest: Ungarn erzürnt über Plan für Regenbogen-Stadion in München,2021-06-21
Mutiertes Coronavirus: Warum die Delta-Variante so gefährlich ist,2021-06-21
Kellner Gunther: »Friends«-Darsteller James Michael Tyler hat Prostatakrebs,2021-06-21
White Square Capital: Hedgefonds-Verlierer bei GameStop-Wette wird abgewickelt,2021-06-21
Bundesregierung: Koalition einigt sich auf ein Klima- und Energiepaket,2021-06-21
Ausbreitung von Delta-Variante: So könnte sich Deutschland gegen eine vierte Welle wappnen,2021-06-21
So könnte sich Deutschland gegen eine vierte Welle wappnen,2021-06-21
Koalition einigt sich auf ein Klima- und Energiepaket,2021-06-21
Hedgefonds-Verlierer bei GameStop-Wette wird abgewickelt,2021-06-21
Pornowebsite: Jugendschützer wollen xHamster sperren,2021-06-21
Uefa verbietet Regenbogen-Arena,2021-06-21
Jugendschützer wollen xHamster sperren,2021-06-21
Unesco will Great Barrier Reef als gefährdet einstufen,2021-06-21
Coronakrise am Mount Everest: Rekord-Bergsteigerin sitzt in Nepal fest,2021-06-21
Tötungsserie in Schleswig-Holstein: Mutmaßlicher Täter schoss offenbar mit Uzi-Maschinenpistole,2021-06-21
Brandenburg: Achtjähriger in Badesee ertrunken,2021-06-21
Wegen Umweltproblemen: Unesco will Great Barrier Reef als gefährdet einstufen,2021-06-21
Debatte über Symbol gegen Homophobie bei der Fußball-EM: Uefa verbietet Regenbogen-Arena,2021-06-21
Kinderschutzbund befürchtet: Kinder werden wieder Corona-Verlierer sein,2021-06-21
Achtjähriger in Badesee ertrunken,2021-06-21
Mutmaßlicher Täter schoss offenbar mit Uzi-Maschinenpistole,2021-06-21
So können Sie Ihren Alterungsprozess beeinflussen,2021-06-21
Pandemie kostet Macau Spitzenplatz: Das sind die reichsten Länder der Welt,2021-06-21
Deutsche Telekom: Wie der Dax-Konzern am Kryptoboom verdient,2021-06-21
Dänemark gegen Russland: ARD bittet um Entschuldigung für emotionalen Reporter Bartels,2021-06-21
Hollywood: Erstmals mehr Frauen im Vorstand der Oscar-Akademie,2021-06-21
Kochen im Homeoffice: Deutsche essen zehn Kilogramm Nudeln im Jahr,2021-06-21
Härtetest für US-Flugzeugträger: Bombensicher,2021-06-21
Einwanderung in Deutschland: Genehmigte Visa für Familiennachzug liegen weit unter Kontingent,2021-06-21
"Rassismus und Rechtsextremismus in Thüringen: Sie trauen sich mitten am Tag, mitten in der Stadt",2021-06-21
Bürokratie und teure Materialien: Bauwirtschaft beklagt steigende Kosten,2021-06-21
EuGH-Urteil zu altem Urheberrecht: YouTube haftet nicht automatisch für hochgeladene Inhalte,2021-06-21
Bessere Wirtschaftsaussichten: Ölpreis steigt erstmals seit zwei Jahren über 75 Dollar,2021-06-21
Produktionsfirma Amblin: Steven Spielberg schließt Vertrag mit Netflix,2021-06-21
Generationenrente der Union: Wenn Vater Staat dem Baby Aktien schenkt,2021-06-21
Wenn Vater Staat dem Baby Aktien schenkt,2021-06-21
Forscher testen Bandwurmmittel gegen Corona,2021-06-21
Bombensicher,2021-06-21
"Sie trauen sich mitten am Tag, mitten in der Stadt",2021-06-21
Deutsche essen zehn Kilogramm Nudeln im Jahr,2021-06-21
Ölpreis steigt erstmals seit zwei Jahren über 75 Dollar,2021-06-21
Rekord-Bergsteigerin sitzt in Nepal fest,2021-06-21
Erstmals mehr Frauen im Vorstand der Oscar-Akademie,2021-06-21
Das Zeiss ist heiß,2021-06-21
Die Feldpost meines Vaters: »Lebst du morgen Abend noch?«,2021-06-21
Philosoph über Transgender: »Nur scheinbar eine klare Diagnose: Du bist im falschen Körper«,2021-06-21
Anti-LGBTQ-Gesetz: Bundesregierung wirft Ungarn Verstoß gegen EU-Werte vor,2021-06-21
Trotz Delta-Variante: Großbritannien bleibt bei Lockdown-Ende im Juli,2021-06-21
Schocktest mit 18.000 Kilo Sprengstoff,2021-06-21
»Lebst du morgen Abend noch?«,2021-06-21
Zielvorgabe: »Verhungern«,2021-06-21
Soldat an allen Fronten,2021-06-21
ARD bittet um Entschuldigung für emotionalen Reporter Bartels,2021-06-21
»Nur scheinbar eine klare Diagnose: Du bist im falschen Körper«,2021-06-21
Ehemaliger US-Präsident: Trump startet seine Rachetour,2021-06-21
Für starke Familien,2021-06-21
Onlinewerbung: EU startet noch ein Verfahren gegen Google,2021-06-21
+++ Livestream +++: Merkel und von der Leyen: So werden die EU-Coronahilfen verteilt,2021-06-21
Wirtschaft unter Druck: Arbeitsminister Heil warnt vor »Corona-Jahrgang in der Ausbildung«,2021-06-21
Hunderte betroffene Mädchen und Jungen: Zwangsadoptionen in der DDR sollen wissenschaftlich untersucht werden,2021-06-21
Umfrage zu Rechtsextremismus: Populismus setzt der gesellschaftlichen Mitte zu,2021-06-21
»Ein Querschläger im Kampf gegen Homophobie«,2021-06-21
Merkel und von der Leyen: So werden die EU-Coronahilfen verteilt,2021-06-21
Populismus setzt der gesellschaftlichen Mitte zu,2021-06-21
Zwangsadoptionen in der DDR sollen wissenschaftlich untersucht werden,2021-06-21
Angriff auf Autobahngegner in Sachsen-Anhalt: Haseloff verurteilt Angriff in Seehausen,2021-06-21
Sibirien: Bär verletzt 16-Jährigen in Nationalpark tödlich,2021-06-21
Arbeitsminister Heil warnt vor »Corona-Jahrgang in der Ausbildung«,2021-06-21
Bauwirtschaft beklagt steigende Kosten,2021-06-21
EU startet noch ein Verfahren gegen Google,2021-06-21
Bär verletzt 16-Jährigen in Nationalpark tödlich,2021-06-21
Hochansteckende Virusmutante: Ärztekammer warnt vor Reisen in Delta-Gebiete,2021-06-21
Fliege stört PK im Weißen Haus: »Wenigstens ist keine Zikade«,2021-06-21
Solidarität aus der Bundesliga nach Uefa-Entscheidung: München darf nicht – jetzt sollen andere Stadien in Regenbogenfarben strahlen,2021-06-21
Abschlussbericht zum Untersuchungsausschuss: Union gibt Scholz Mitschuld an Wirecard-Skandal,2021-06-21
»Next Generation EU«: EU-Kommission billigt deutschen Aufbauplan nach der Coronakrise,2021-06-21
Union gibt Scholz Mitschuld an Wirecard-Skandal,2021-06-21
Das sagt Münchens Oberbürgermeister zum Verbot der Regenbogen-Arena,2021-06-21
»Eine politisch feige Entscheidung«,2021-06-21
Bundesregierung wirft Ungarn Verstoß gegen EU-Werte vor,2021-06-21
EU-Kommission billigt deutschen Aufbauplan nach der Coronakrise,2021-06-21
Merkel gegen volle Fußball-Stadien in Großbritannien,2021-06-21
Coronapandemie: Trump wollte infizierte US-Bürger offenbar nach Guantánamo schicken,2021-06-21
Pandemie beschert Luxemburg Spitzenplatz: Das sind die reichsten Länder der Welt,2021-06-21
Pakt mit US-Investor Andreessen Horowitz: Wie die Telekom am Kryptoboom verdient,2021-06-21
»Du hast die Musik ruiniert«: Rapper T-Pain gibt Usher Schuld an seiner Depression,2021-06-21
Nordkorea: Schwester von Kim Jong Un warnt USA vor »falschen« Erwartungen,2021-06-21
Vermögensstudie: Zahl der Dollar-Millionäre in Deutschland stark gewachsen,2021-06-21
Fliege stört PK im Weißen Haus: »Wenigstens ist es keine Zikade«,2021-06-21
+++ Livestream +++: Das sagt Münchens Oberbürgermeister zum Verbot der Regenbogen-Arena,2021-06-21
Schwester von Kim Jong Un warnt USA vor »falschen« Erwartungen,2021-06-21
Kursrutsch der Kryptowährung: Bitcoin stürzt unter 30.000 US-Dollar,2021-06-21
"Münchens OB Reiter kritisiert Regenbogen-Verbot: »Ich finde es beschämend, dass die Uefa uns verbietet, ein Zeichen zu setzen«",2021-06-21
Traum und Wirklichkeit: So geht es der Wirtschaft fünf Jahre nach dem Brexit-Votum,2021-06-21
Duisburger Zoo freut sich über Tigernachwuchs: »Sie sind dick und rund und werden immer agiler«,2021-06-21
Tödliche Kollision auf dem Gardasee: Verdächtige Deutsche sind zurück in München,2021-06-21
So geht es der Wirtschaft fünf Jahre nach dem Brexit-Votum,2021-06-21
"»Ich finde es beschämend, dass die Uefa uns verbietet, ein Zeichen zu setzen«",2021-06-21
»Sie sind dick und rund und werden immer agiler«,2021-06-21
Pressekonferenz: Das sagt Münchens Oberbürgermeister zum Verbot der Regenbogen-Arena,2021-06-21
Vermögensstudie: Zahl der Dollarmillionäre in Deutschland stark gewachsen,2021-06-21
Riskante Wette: Risikokapital-Fonds investieren 17 Milliarden Dollar in Krypto-Firmen,2021-06-21
NFL-Profi Carl Nassib: Einfach nur ein schwuler Footballer,2021-06-21
A3 bei Regensburg: Auto rammt Lkw – vier Tote,2021-06-21
Sachsen hebt Maskenpflicht im Freien auf,2021-06-21
Einfach nur ein schwuler Footballer,2021-06-21
Rekordwette: Fonds investieren 17 Milliarden Dollar in Krypto-Firmen,2021-06-21
Debatte über Münchner Arena vor dem Ungarnspiel: Over the Rainbow,2021-06-21
Coronaschutz: Bundeskanzlerin zum zweiten Mal geimpft,2021-06-21
Männermode aus Mailand: Absolute Beinfreiheit,2021-06-21
Serienhit »It's a Sin« über Aids: Die andere Pandemie,2021-06-21
Bundeskanzlerin zum zweiten Mal geimpft,2021-06-21
Die andere Pandemie,2021-06-21
Absolute Beinfreiheit,2021-06-21
Riskante Wette: Fonds investieren 17 Milliarden Dollar in Krypto-Firmen,2021-06-21
Neuer Bericht: Corona erhöht das Sterberisiko für Herzpatienten,2021-06-21
Abspaltungsversuch 2017: Spanien begnadigt katalanische Separatisten,2021-06-21
Heizkosten: Scheitern des CO₂-Kompromisses erzürnt SPD und Umweltschützer,2021-06-21
Over the Rainbow,2021-06-21
Scheitern des CO₂-Kompromisses erzürnt SPD und Umweltschützer,2021-06-21
Trotz Bitcoin-Kursrutsch: VC-Fonds investieren 17 Milliarden Dollar in Krypto-Firmen,2021-06-21
Kursrutsch der Kryptowährung: Bitcoin stürzt unter 30.000 US-Dollar - und fällt weiter,2021-06-21
Radikalisierung in Coronakrise: Europol warnt vor Zulauf für Terroristen,2021-06-21
Brennende Barrikaden in Berlin: Kampf um die Rigaer Straße,2021-06-21
"»Klimabericht«-Podcast: Tanken, Fliegen, Essen – das riskante Spiel mit »Klimaneutralität«",2021-06-21
Kehrtwende: Deutsche Bahn bringt 20 stillgelegte Strecken wieder in Schuss,2021-06-21
Zu hohe Bleiwerte: Lidl ruft Nudelsoßen zurück,2021-06-21
Corona erhöht das Sterberisiko für Herzpatienten,2021-06-21
Biontech hält Impfstoffanpassung derzeit für unnötig,2021-06-21
"Tanken, Fliegen, Essen – das riskante Spiel mit »Klimaneutralität«",2021-06-21
Spanien begnadigt katalanische Separatisten,2021-06-21
Deutsche Bahn bringt 20 stillgelegte Strecken wieder in Schuss,2021-06-21
Kampf um die Rigaer Straße,2021-06-21
Möglicher Therapieansatz: Forscher testen Bandwurmmittel gegen Corona,2021-06-21
Gewalt gegen die Polizei: Verletzte und verletzende Polizisten,2021-06-21
Sportliches Distancing,2021-06-21
Missbrauchskomplex Münster: Schwere Misshandlung eines Kleinkindes – Polizei fahndet nach Verdächtigem,2021-06-21
Am Rheinufer bei Bonn: Mann hält Angelutensilien für Leiche – Großeinsatz der Polizei,2021-06-21
Umstrittener Schwimm-Olympiasieger: Dopingsperre gegen Sun Yang auf vier Jahre halbiert,2021-06-21
Ermordeter CDU-Politiker: Kassel benennt Brücke nach Walter Lübcke,2021-06-21
Baby-Medikament im Urin: Schubenkow von Dopingverdacht freigesprochen,2021-06-21
München darf nicht – jetzt sollen andere Stadien in Regenbogenfarben strahlen,2021-06-21
"Baerbock, Laschet und Scholz umwerben die Bosse",2021-06-21
Verletzte und verletzende Polizisten,2021-06-21
Wien plant Impfparty für Jugendliche,2021-06-21
Schwere Misshandlung eines Kleinkindes – Polizei fahndet nach Verdächtigem,2021-06-21
Schubenkow von Dopingverdacht freigesprochen,2021-06-21
Dopingsperre gegen Sun Yang auf vier Jahre halbiert,2021-06-21
Großeinsatz in Frankfurt: 41-Jähriger greift Beamte an – Polizisten geben mutmaßlich tödliche Schüsse ab,2021-06-21
Verdacht auf Beihilfe zur Untreue: Razzia beim früheren Wirecard-Aufsichtsratschef,2021-06-21
Die Pandemie und das Wetter: Ist der Sommer ein Viruskiller?,2021-06-21
Ist der Sommer ein Viruskiller?,2021-06-21
Amerikas Wüterich meldet sich zurück,2021-06-21
Razzia beim früheren Wirecard-Aufsichtsratschef,2021-06-21
Wembley-Stadion: Mehr als 60.000 Fans dürfen zum Endspiel,2021-06-21
»Keine Straftat begangen«: Verteidigung von Sarkozy plädiert auf Freispruch,2021-06-21
"DFB-Elf vor Ungarn-Spiel: Müller läuft, Kimmich spielt Gitarre und der Bundestrainer grübelt",2021-06-21
Internationaler Strafgerichtshof verhandelt über Ökozid: Gibt es bald einen Paragrafen für Mord am Planeten?,2021-06-21
41-Jähriger attackierte offenbar Beamte: Ein Toter nach Polizeischüssen in Frankfurt am Main,2021-06-21
Mehr als 60.000 Fans dürfen zum Endspiel,2021-06-21
"Müller läuft, Kimmich spielt Gitarre und der Bundestrainer grübelt",2021-06-21
Gibt es bald einen Paragrafen für Mord am Planeten?,2021-06-21
Ein Toter nach Polizeischüssen in Frankfurt am Main,2021-06-21
Urteil in Leipzig: Tödlicher Streit um nicht angeleinten Hund – neun Jahre Haft,2021-06-23
"Untersuchung der ""New York Times"": Labor findet in Thunfisch-Sandwich von Subway keine Thunfisch-DNA",2021-06-23
Fußball-EM 2021: Mit dem Außenrist in den Winkel – Modrić führt Kroatien ins Achtelfinale,2021-06-23
Sieg gegen Tschechien bei Fußball-EM: Sterling köpft England zum Gruppensieg,2021-06-23
Tod nach Festnahme: Tschechische Polizei weist George-Floyd-Vergleich zurück,2021-06-23
Forscher finden Hinweise auf zahllose unbekannte Tiefsee-Arten,2021-06-23
Drosten: Delta muss sich in Deutschland nicht entwickeln wie in Großbritannien,2021-06-23
Bundeswehr steht vor gefährlichster Phase ihres Abzugs,2021-06-23
Harsche Kritik an SPD-Chefin Esken – aus der eigenen Fraktion,2021-06-23
Darum vergiftet eine alte Rassismus-Theorie jetzt die Debatte,2021-06-23
Mit dem Außenrist in den Winkel – Modrić führt Kroatien ins Achtelfinale,2021-06-23
Sterling köpft England zum Gruppensieg,2021-06-23
Münchner Polizei erwartet »problematische« Fans aus Ungarn,2021-06-23
DFB unterstützt Verteilen von Regenbogenfahnen,2021-06-23
Vatikan will italienisches Gesetz gegen Homophobie ändern,2021-06-23
Tschechische Polizei weist George-Floyd-Vergleich zurück,2021-06-23
Experten warnen vor Risiken beim Klimakraftstoff Ammoniak,2021-06-23
Gesuchter stellt sich in Berlin,2021-06-23
Billie Eilish entschuldigt sich nach Rassismusvorwürfen,2021-06-23
Labor findet in Thunfisch-Sandwich von Subway keine Thunfisch-DNA,2021-06-23
Bettina und Christian Wulff zeigen sich erstmals wieder gemeinsam,2021-06-23
"Schießen, laufen, noch mal schießen",2021-06-23
Das hilft wirklich gegen Reizdarm,2021-06-23
Die Erfolgsgeheimnisse lebenslanger Beziehungen,2021-06-23
Die Lage am Abend: Amerikas Wüterich meldet sich zurück,2021-06-23
Philippinischer Präsident Duterte: »Entweder impfen lassen oder ins Gefängnis«,2021-06-23
Gastbeitrag in der »Zeit«: Putin räumt Fehler ein – und zwar die des Westens,2021-06-23
SEK in Hessen: Polizisten distanzierten sich von rechtsextremen Inhalten in Chatgruppen,2021-06-23
Gegendarstellung,2021-06-23
Knapp 150 Kilometer: Lufthansa streicht Ultrakurzstrecke München-Nürnberg,2021-06-23
"Tag der Industrie: Baerbock, Laschet und Scholz umwerben die Bosse",2021-06-23
"16-Jährige trifft 35-Jährigen: Die Kunst, von der Liebe zu erzählen, ohne dass es peinlich wird",2021-06-23
Familienunternehmen: Warum Martina Reischmann die Firma ihres Vaters nicht übernehmen will,2021-06-23
Sanktionen gegen Teheran: USA blockieren 33 staatliche iranische Medien-Websites,2021-06-23
Nachwuchs: Zoo in Tokio meldet Geburt von Panda-Zwillingen,2021-06-23
EM-Spiel zwischen Deutschland und Ungarn: Orbán sagt offenbar Reise nach München ab,2021-06-23
Teilzeitarbeit stärken: Bertelsmann Stiftung rät zu Reform der Minijobs,2021-06-23
Ungewöhnlicher Geburtstagsgruß: Künstler benennt U-Bahn-Station nach Meryl Streep,2021-06-23
Wie Deutschland seine Firmen alleinlässt,2021-06-23
Warum Biden für Deutschland viel unbequemer ist als Trump,2021-06-23
Freibäder setzen bei Coronazoff Sicherheitsdienste ein,2021-06-23
Ärzteverband verlangt höheres Impftempo gegen Delta-Variante,2021-06-23
Wie Impfverweigerer in Texas ihren Job verloren,2021-06-23
Lehrerverband fordert Präsenzunterricht – trotz Delta-Variante,2021-06-23
"Weltklimarat warnt vor »irreversiblen« Folgen bei Erderwärmung von über 1,5 Grad",2021-06-23
Lukaschenko pöbelt gegen Deutschland,2021-06-23
Bertelsmann Stiftung rät zu Reform der Minijobs,2021-06-23
US-Demokraten erleiden Rückschlag bei Wahlrechtsreform,2021-06-23
New Yorker stimmen über Spitzenkandidaten ab – Ex-Polizist Eric Adams liegt vorn,2021-06-23
Täter im Fall Khashoggi offenbar in den USA ausgebildet,2021-06-23
Forscher finden Hinweise auf zahllose unbekannte Tiefseearten,2021-06-23
»Unsere Wirtschaft sucht händeringend nach Fachkräften«,2021-06-23
"»Kämpft mit allem, was ihr finden könnt«",2021-06-23
Darum vergiftet eine alte Rassismustheorie jetzt die Debatte,2021-06-23
Mit Papa in Wankdorf,2021-06-23
Favoritenstatus auf dem Prüfstand,2021-06-23
Diese Teams sind bereits im Achtelfinale,2021-06-23
Brüderlich mit Herz und Hand – auch auf dem Platz,2021-06-23
Britney Spears wehrte sich schon früher gegen Vormundschaft ihres Vaters,2021-06-23
Vermisste Neunjährige tot aufgefunden,2021-06-23
»Viele Menschen haben nicht einen einzigen Freund«,2021-06-23
Fahrradhelm für 45 Euro schützt bei Crashs am besten,2021-06-23
Twitter-Stars testen neue Funktionen zum Geldverdienen,2021-06-23
Söldner in Bürgerkriegsland: Maas fordert Abzug aller ausländischen Kämpfer aus Libyen,2021-06-23
Umstrittener Staatstrojaner: Harsche Kritik an SPD-Chefin Esken – aus der eigenen Fraktion,2021-06-23
Trotz erfolgreicher Kampagne: Joe Biden verpasst US-Impfziel zum Independence Day,2021-06-23
Englischer Gruppensieg bei der Fußball-EM: Sieht so Versöhnung aus?,2021-06-23
Körpersprache: Was Führungskräfte von Schiedsrichtern lernen können,2021-06-23
P&C sondiert feindliche Übernahme: Verhasster Schwesterkonzern auf Schnäppchenjagd,2021-06-23
Steigende Zahlen: Jeder fünfte Coronafall in Hessen geht auf Delta-Variante zurück,2021-06-23
"»Quake«-Jubiläum: Schießen, laufen, noch mal schießen",2021-06-23
»Es ist mir peinlich«: Billie Eilish entschuldigt sich nach Rassismusvorwürfen,2021-06-23
Traumberuf Feuerwehrtaucher,2021-06-23
Bonn: Student bricht zusammen – Kommilitonen müssen Examen weiterschreiben,2021-06-23
Sanktionen gegen Teheran: USA blockieren 33 staatliche iranische Medienwebsites,2021-06-23
Orbán sagt offenbar Reise nach München ab,2021-06-23
Zoo in Tokio meldet Geburt von Panda-Zwillingen,2021-06-23
Die Lage am Morgen: Warum Biden für Deutschland viel unbequemer ist als Trump,2021-06-23
Sanktionen: US-Behörden blockieren Websites iranischer Staatsmedien,2021-06-23
Frau von Frank-Walter Steinmeier: First Lady Büdenbender hat sich Fuß gebrochen,2021-06-23
Von der Leyen droht Ungarn mit rechtlichen Schritten wegen LGBTQ-Gesetz,2021-06-23
Chinakritische »Apple Daily« stellt Betrieb ein,2021-06-23
Englands gescholtene Abwehr wird zum Retter – doch reicht das?,2021-06-23
Bahn baut 83 Oberleitungsmasten auf geplante Radschnellweg-Trasse,2021-06-23
"Furcht, Frust, Forschen",2021-06-23
+++ Livestream +++: Das sagt US-Außenminister Blinken beim Antrittsbesuch in Berlin,2021-06-23
Taliban-Vormarsch in Afghanistan: Bundeswehr steht vor gefährlichster Phase ihres Abzugs,2021-06-23
Bürgermeisterwahl im November: New Yorker stimmen über Spitzenkandidaten ab – Ex-Polizist Eric Adams liegt vorn,2021-06-23
Blockade im Senat: US-Demokraten erleiden Rückschlag bei Wahlrechtsreform,2021-06-23
Familienplanung statt Milliarden: Paris Hilton ist »mehr an Babys interessiert«,2021-06-23
A57 in Nordrhein-Westfalen: Kipplaster verliert Klärschlamm – zwei Leichtverletzte,2021-06-23
Vor DFB-Länderspiel gegen Ungarn: Mit Papa in Wankdorf,2021-06-23
Integrationsbeauftragte Widmann-Mauz: »Unsere Wirtschaft sucht händeringend nach Fachkräften«,2021-06-23
Bergbau am Meeresboden: Forscher finden Hinweise auf zahllose unbekannte Tiefseearten,2021-06-23
»Super Follows« und Sondertickets: Twitter-Stars testen neue Funktionen zum Geldverdienen,2021-06-23
Das sagt US-Außenminister Blinken beim Antrittsbesuch in Berlin,2021-06-23
Darum ist Ungarn für Deutschland ein schwierigerer Gegner als Portugal,2021-06-23
"Frieden, wie Erdoğan und Putin ihn wollen",2021-06-23
Olympia-Zuschauer dürfen nicht jubeln,2021-06-23
Student bricht zusammen – Kommilitonen müssen Examen weiterschreiben,2021-06-23
13 Jahre unter Vormundschaft - jetzt will Britney Spears ihr Schweigen brechen,2021-06-23
Elbufer in Schleswig-Holstein: Vermisste Neunjährige tot aufgefunden,2021-06-23
EM-Gruppensieger: Englands gescholtene Abwehr wird zum Retter – doch reicht das?,2021-06-23
Exportverbot aufgehoben: Argentinische Farmer dürfen wieder Rindfleisch ins Ausland verkaufen,2021-06-23
Streit um Vormundschaft: 13 Jahre unter Vormundschaft – jetzt will Britney Spears ihr Schweigen brechen,2021-06-23
"Libyen-Gipfel in Berlin: Frieden, wie Erdoğan und Putin ihn wollen",2021-06-23
EU-Kommissionspräsidentin: Von der Leyen droht Ungarn mit rechtlichen Schritten wegen LGBTQ-Gesetz,2021-06-23
13 Jahre unter Vormundschaft – jetzt will Britney Spears ihr Schweigen brechen,2021-06-23
Nach Sanktionen gegen Belarus: Lukaschenko pöbelt gegen Deutschland,2021-06-23
Bericht über US-Sängerin: Britney Spears wehrte sich schon früher gegen Vormundschaft ihres Vaters,2021-06-23
Los Angeles: Polizei ermittelt wegen mutmaßlichen Übergriffs auf Anwesen von Chris Brown,2021-06-23
Kochen ohne Kohle: Freiheits-Focaccia für gesellige Grillabende – für 1 Euro,2021-06-23
"Unerwartete EM-Euphorie: Endlich, die Nerven flattern",2021-06-23
Uefa verbietet Regenbogenbeleuchtung: Mächtiger als jedes Marketing-Gelaber,2021-06-23
Als Soldatin in Afghanistan: »Was waren wir blauäugig!«,2021-06-23
»Was waren wir blauäugig!«,2021-06-23
Mächtiger als jedes Marketing-Gelaber,2021-06-23
"Endlich, die Nerven flattern",2021-06-23
Olympiazuschauer dürfen nicht jubeln,2021-06-23
Freiheits-Focaccia für gesellige Grillabende – für 1 Euro,2021-06-23
US-Außenminister Blinken in Berlin: Maas kündigt Lösung für Nord Stream 2-Streit bis August an,2021-06-23
Neuss in NRW: Autofahrer fährt hochschwangere Frau an und flüchtet,2021-06-23
Ende der Homeoffice-Pflicht: Wer langfristig von zu Hause arbeiten darf – und wer nicht,2021-06-23
"Nasa lässt Weltraumwaschmittel entwickeln: Ist der neu? Nein, im All gewaschen!",2021-06-23
Ecken und Freistöße der DFB-Elf: Die gefährliche deutsche Schwäche bei Standardsituationen,2021-06-23
Die gefährliche deutsche Schwäche bei Standardsituationen,2021-06-23
"Ist der neu? Nein, im All gewaschen!",2021-06-23
Pressekonferenz: Das sagt US-Außenminister Blinken beim Antrittsbesuch in Berlin,2021-06-23
Gepriesener Ölersatz: Experten warnen vor Risiken beim Klimakraftstoff Ammoniak,2021-06-23
Corona-Erholung: Marktforscher sagen Rekord-Wachstum voraus,2021-06-23
Eine Trauerbegleiterin erzählt: Wenn Kinder durch ein Gewaltverbrechen sterben,2021-06-23
Hongkong: Erster Aktivist steht unter dem umstrittenen »Sicherheitsgesetz« vor Gericht,2021-06-23
Großbrand zerstört Dorf: Aufräumarbeiten in verwüstetem polnischen Ort dauern an,2021-06-23
Marktforscher sagen Rekord-Wachstum voraus,2021-06-23
Corona-Regeln am Arbeitsplatz werden gelockert,2021-06-23
Wenn Kinder durch ein Gewaltverbrechen sterben,2021-06-23
"»Je mehr ich hineinsank, desto mehr kapselte ich mich ab. Ich schämte mich so«",2021-06-23
US-Außenminister Blinken in Berlin: Maas kündigt Lösung für Nord-Stream-2-Streit bis August an,2021-06-23
Kampf gegen Pressefreiheit in Hongkong: Chinakritische »Apple Daily« stellt Betrieb ein,2021-06-23
Gericht weist Klagen von Klinikpersonal ab: Wie Impfverweigerer in Texas ihren Job verloren,2021-06-23
Bundeswehr-Skandal in Litauen: Kramp-Karrenbauer stellt Panzergrenadier-Zug komplett neu auf,2021-06-23
Zehntausende Kundendaten betroffen: Hacker stoßen erneut auf Sicherheitslücken bei Corona-Testzentren,2021-06-23
Lüchow-Dannenberg: Erster Landkreis ist komplett coronafrei,2021-06-23
Mit 70 Mitarbeitern: Finanzministerium gründet Institut für Steuerforschung,2021-06-23
100 Milliarden Euro neue Schulden: Kabinett billigt Haushaltspläne für 2022 – und Klimaschutz-Sofortprogramm,2021-06-23
Russland warnt britischen Zerstörer mit Schüssen und Bomben,2021-06-23
Der Bundestag befragt Kanzlerin Merkel – zum letzten Mal,2021-06-23
Maas kündigt Lösung für Nord-Stream-2-Streit bis August an,2021-06-23
Marktforscher sagen Rekordwachstum voraus,2021-06-23
