Teaser,Date
"CDU/CSU im Rückwärtsgang: Klimaschutz? Ach nö, jetzt noch nicht",2021-06-20
Bilder der Woche: Was von einem gestrandeten Frachter übrig bleibt,2021-06-20
ARD-Sonntagskrimi: Der »Polizeiruf« aus München im Schnellcheck,2021-06-20
Nach Havarie: »Ever Given«-Eigentümer bieten laut Suezkanal-Behörde Millionenentschädigung an,2021-06-20
Delta-Variante macht in Lissabon mehr als 60 Prozent aller Fälle aus,2021-06-20
»Ever Given«-Eigentümer bieten laut Suezkanal-Behörde Millionenentschädigung an,2021-06-20
Der »Polizeiruf« aus München im Schnellcheck,2021-06-20
Was von einem gestrandeten Frachter übrig bleibt,2021-06-20
"Türkei gegen Schweiz: Tritte, Schläge und ein Harnröhrenriss – als ein Fußballspiel zur Schande wurde",2021-06-20
Misslungene Protestaktion bei Fußball-EM: Greenpeace bittet in Brief an Fördermitglieder um Verzeihung,2021-06-20
"Klimaschutz? Ach nö, jetzt noch nicht",2021-06-20
"Tritte, Schläge und ein Harnröhrenriss – als ein Fußballspiel zur Schande wurde",2021-06-20
Greenpeace bittet in Brief an Fördermitglieder um Verzeihung,2021-06-20
Mehr als 500.000 Tote: Zehntausende Brasilianer demonstrieren gegen Bolsonaros Coronapolitik,2021-06-20
"SPIEGEL-Taktiktafel zum EM-Sieg gegen Portugal: Das 20-Sekunden-Tor, das zeigt, wie der Plan mit Kimmich und Gosens aufging",2021-06-20
"EM-Sieg gegen Portugal: Jubel, Trubel, Sorglosigkeit",2021-06-20
Formel 1: Nächster Red-Bull-Sieg – Verstappen gewinnt Großen Preis von Frankreich,2021-06-20
Belgien: Terrorverdächtiger Soldat offenbar tot aufgefunden,2021-06-20
Terrorverdächtiger Soldat offenbar tot aufgefunden,2021-06-20
Zikadenplage in den USA: Ein tierisches Problem,2021-06-20
Gegen »Kulturalschaden«: Bootsdemo für Partys und Clubs in Berlin,2021-06-20
"Danke für die Abkühlung, bis zum nächsten Zoff",2021-06-20
"Jubel, Trubel, Sorglosigkeit",2021-06-20
Nächster Red-Bull-Sieg – Verstappen gewinnt Großen Preis von Frankreich,2021-06-20
Kursrutsch der Kryptowährung: Bitcoin stürzt unter 34.000 Dollar - Cyberattacken nehmen zu,2021-06-20
"Entführungen in Uganda: »Wir finden ständig Menschen, die am Straßenrand abgeladen werden, tot oder lebendig«",2021-06-20
Rätsel der Woche: Hundert Quadratzahlen,2021-06-20
Wechsel bei ARD-»Tagesthemen«: Aline Abboud folgt Pinar Atalay,2021-06-20
Gegen »Kulturalschaden«: Bootsdemo für Partys und Klubs in Berlin,2021-06-20
Das Wahlprogramm im Überblick,2021-06-20
Bootsdemo für Partys und Klubs in Berlin,2021-06-20
Hundert Quadratzahlen,2021-06-20
Aline Abboud folgt Pinar Atalay,2021-06-20
»Geschichte«-Podcast: Antisemitismus – eine deutsche Tradition?,2021-06-20
"»Wir finden ständig Menschen, die am Straßenrand abgeladen werden, tot oder lebendig«",2021-06-20
Antisemitismus – eine deutsche Tradition?,2021-06-20
Die Linke: Das Wahlprogramm im Überblick,2021-06-20
Mehr Verkehr: Autodichte in Großstädten steigt weiter an,2021-06-20
Aktionstag einer Telegram-Gruppe: Wie Georg beinahe zwei Millionen Menschen nach Berlin brachte,2021-06-20
Wie Georg beinahe zwei Millionen Menschen nach Berlin brachte,2021-06-20
Ein tierisches Problem,2021-06-20
Umstrittene Endrunde 2022: Norwegen lehnt Boykott der WM in Katar ab,2021-06-20
"Mini-Beamer von Asus, BenQ, ViewSonic und Anker im Test: So machen Sie jeden Ort zum smarten Kino",2021-06-20
"Befristete Verträge, Abhängigkeit, Unsicherheit: Arbeiten an der Uni? Muss man sich leisten können",2021-06-20
"Bye, bye, Biden",2021-06-20
Spahn rät von Besuch des EM-Finales in London ab,2021-06-20
Arbeiten an der Uni? Muss man sich leisten können,2021-06-20
So machen Sie jeden Ort zum smarten Kino,2021-06-20
Entwicklungsländer als Krypto-Pioniere: El Salvador träumt vom Bitcoin-Paradies,2021-06-20
"Steuern, Klima, Rente: Unions-Führung weitgehend einig über Wahlprogramm",2021-06-20
"Bye-bye, Biden",2021-06-20
Unions-Führung weitgehend einig über Wahlprogramm,2021-06-20
Norwegen lehnt Boykott der WM in Katar ab,2021-06-20
Zeichen für Diversität und Toleranz: Uefa prüft Regenbogen-Kapitänsbinde von Manuel Neuer,2021-06-20
Regionalwahlen: Historisch niedrige Wahlbeteiligung in Frankreich,2021-06-20
"Fußball-EM: Schweiz darf aufs Achtelfinale hoffen, Türkei ist raus",2021-06-20
Sieg gegen Wales bei Fußball-EM: Italien zieht ohne Gegentor ins Achtelfinale,2021-06-20
Glaubensfrage bei den Christdemokraten: Wie nahe steht Armin Laschet dem ultrakonservativen Opus Dei?,2021-06-20
El Salvador träumt vom Bitcoin-Paradies,2021-06-20
Historisch niedrige Wahlbeteiligung in Frankreich,2021-06-20
Unionsführung weitgehend einig über Wahlprogramm,2021-06-20
Italien zieht ohne Gegentor ins Achtelfinale,2021-06-20
"Schweiz darf aufs Achtelfinale hoffen, Türkei ist raus",2021-06-20
Uefa prüft Regenbogen-Kapitänsbinde von Manuel Neuer,2021-06-20
Wie nahe steht Armin Laschet dem ultrakonservativen Opus Dei?,2021-06-20
Kursrutsch der Kryptowährung: Bitcoin stürzt unter 35.000 Dollar - Cyberattacken nehmen zu,2021-06-20
Isolation während der Pandemie: Warum Einsamkeit krank macht – und was dagegen hilft,2021-06-20
Berater der Regierung über weiteren Pandemieverlauf: »Ich mache mir Sorgen um die ungeimpften Kinder in der Schule«,2021-06-20
Sturmtief in den USA: Neun Kinder bei Massenkarambolage getötet,2021-06-20
Formel 1 in Frankreich: Für Bottas wird es eng,2021-06-20
Rätselhafter Sarkophag-Fund in Trier: Was dieser Grabschatz über die römische Elite verrät,2021-06-20
»Ich mache mir Sorgen um die ungeimpften Kinder in der Schule«,2021-06-20
Warum Einsamkeit krank macht – und was dagegen hilft,2021-06-20
Für Bottas wird es eng,2021-06-20
Neun Kinder bei Massenkarambolage getötet,2021-06-20
Klippenspringer stirbt nach 40-Meter-Sprung,2021-06-20
Was dieser Grabschatz über die römische Elite verrät,2021-06-20
Zeichen für Diversität und Toleranz: Uefa stellt Ermittlungen wegen Regenbogen-Kapitänsbinde von Manuel Neuer ein,2021-06-20
Mehr netto: Zehn Alternativen zur Gehaltserhöhung,2021-06-20
Wahlgebete,2021-06-20
Bundestagsvizepräsidentin: Roth fordert Studie über Rechtsextremismus bei Bundestagspolizei,2021-06-20
Italiens Sieg bei der EM gegen Wales: Unüberwindbare Squadra Azzurra,2021-06-20
Katar plant Fußball-WM nur für Corona-Geimpfte,2021-06-20
Roth fordert Studie über Rechtsextremismus bei Bundestagspolizei,2021-06-20
Uefa stellt Ermittlungen wegen Regenbogen-Kapitänsbinde von Manuel Neuer ein,2021-06-20
Unüberwindbare Squadra Azzurra,2021-06-20
"Jabeur erste arabische Turniersiegerin auf WTA-Tour: »Ich musste diesen Titel gewinnen, um ein Vorbild zu sein«",2021-06-20
Weltraumspaziergang an der ISS: Astronauten montieren neues Sonnensegel,2021-06-20
Astronauten montieren neues Sonnensegel,2021-06-20
"»Ich musste diesen Titel gewinnen, um ein Vorbild zu sein«",2021-06-20
Sieg gegen Wales bei Fußball-EM: Italien zieht ohne Gegentor ins Achtelfinale ein,2021-06-20
Panini-Sammelalbum: Millionen-Stichprobe zeigt extreme Ungleichverteilung bei EM-Stickern,2021-06-20
Vorwürfe gegen »schwule Kiezpraxis«: Der unkonventionelle Dr. J.,2021-06-20
"Italiens Milliardenplan für die »grüne Revolution«: »Wenn es zu heiß wird, müssen wir den Sommer in Deutschland verbringen«",2021-06-20
"»Wenn es zu heiß wird, müssen wir den Sommer in Deutschland verbringen«",2021-06-20
Millionen-Stichprobe zeigt extreme Ungleichverteilung bei EM-Stickern,2021-06-20
Der unkonventionelle Dr. J.,2021-06-20
"Parteitag der Linken: Danke für die Abkühlung, bis zum nächsten Zoff",2021-06-20
Hochrechnungen: Armeniens Premier steht vor klarem Sieg gegen Putin-Vertrauten,2021-06-20
Armeniens Premier steht vor klarem Sieg gegen Putin-Vertrauten,2021-06-20
"Rekordbaby: 340 Gramm Geburtsgewicht, null Prozent Überlebenschance – und jetzt der erste Geburtstag",2021-06-20
"340 Gramm Geburtsgewicht, null Prozent Überlebenschance – und jetzt der erste Geburtstag",2021-06-20
Täter im Nationalsozialismus: »Mit den beiden Juden-Mädchen bist Du ja gerade nicht sehr sanft umgegangen«,2021-06-20
Satellitenbild der Woche: Die zerstörerischen Machenschaften der Gold-Schürfer,2021-06-20
Studienfächer erklärt: Was ich als Erstsemester gern über VWL gewusst hätte,2021-06-20
Krimi-Vote: Wie gefiel Ihnen der München-»Polizeiruf«?,2021-06-20
Ratgeber Rad Furo Aventa: E-Bike ohne Firlefanz,2021-06-20
Neuseeland: Gewichtheberin Laurel Hubbard tritt als erste Transgender-Person bei Olympia an,2021-06-20
Die zerstörerischen Machenschaften der Gold-Schürfer,2021-06-20
Gewichtheberin Laurel Hubbard tritt als erste Transgender-Person bei Olympia an,2021-06-20
Was ich als Erstsemester gern über VWL gewusst hätte,2021-06-20
Wie gefiel Ihnen der München-»Polizeiruf«?,2021-06-20
E-Bike ohne Firlefanz,2021-06-20
»Fünf Millionen Versuchskaninchen«: EU-Bürger bangen um Aufenthaltsrecht in Großbritannien,2021-06-20
"+++ Corona-News +++: RKI meldet 346 Neuinfektionen, Sieben-Tage-Inzidenz sinkt weiter",2021-06-20
EU-Bürger bangen um Aufenthaltsrecht in Großbritannien,2021-06-20
"RKI meldet 346 Neuinfektionen, Sieben-Tage-Inzidenz sinkt weiter",2021-06-20
Intuitiv essen (3/8): Den Geschmackssinn fordern,2021-06-20
SPIEGEL Daily Podcast: Traum vom Eigenheim: Ist das Modell Einfamilienhaus am Ende?,2021-06-20
Intuitiv essen (4/8): Entspannt bleiben,2021-06-20
Polizei im Großeinsatz: Schüsse in Berlin – mehrere Verletzte,2021-06-20
Schüsse in Berlin – mehrere Verletzte,2021-06-20
Nikol Paschinjan: Armeniens Regierungschef gewinnt die Parlamentswahl,2021-06-20
Zum »Prime Day«: Ver.di ruft Amazon-Mitarbeiter zum Streik auf,2021-06-20
Schwaches Ergebnis für Frankreichs Rechtsextreme bei Regionalwahlen,2021-06-20
Ver.di ruft Amazon-Mitarbeiter zum Streik auf,2021-06-20
Armeniens Regierungschef gewinnt die Parlamentswahl,2021-06-20
Die zerstörerischen Machenschaften der Goldschürfer,2021-06-20
Gewichtheberin Laurel Hubbard tritt als erste Transperson bei Olympia an,2021-06-20
"Klarna-Chef Sebastian Siemiatkowski: ""Die Gewinne der Finanzindustrie werden sinken""",2021-06-20
Finanzmarktprognose 2021: Im Herbst wird es brenzlig,2021-06-20
U.S. Open: Rahm macht ersten Majorsieg mit spektakulärem Finish perfekt,2021-06-20
Matthias Schweighöfer über Pandemie: »Ich konnte mehr Papa sein«,2021-06-20
"Sommersonnenwende 2021: Wissen Sie, wann der Sommer wirklich beginnt?",2021-06-20
Buschehr: Iran schaltet Atomkraftwerk nach »technischem Fehler« vorerst ab,2021-06-20
"Warum es beschämend ist, Steuererhöhungen auszuschließen",2021-06-20
Iran schaltet Atomkraftwerk nach »technischem Fehler« vorerst ab,2021-06-20
Rahm macht ersten Majorsieg mit spektakulärem Finish perfekt,2021-06-20
Schrumpfungskurs befürchtet: BMW-Chef warnt vor zu frühem Abschied vom Verbrenner,2021-06-20
Schwaches Ergebnis für Frankreichs Rechtspopulisten bei Regionalwahlen,2021-06-20
Europas wertvollstes Start-up: Wie der Klarna-Chef mit seinem Super-Fintech weiter wachsen will,2021-06-20
"Guter Sound kann teuer sein, muss er aber nicht",2021-06-20
Auf Touren kommen,2021-06-20
Haut ab!,2021-06-20
Magnetische Ladegeräte und Zubehör für iPhones im Test,2021-06-20
Neue Bildungsstudie: Distanzunterricht gerade mal so effektiv wie Sommerferien,2021-06-20
Distanzunterricht gerade mal so effektiv wie Sommerferien,2021-06-20
BMW-Chef warnt vor zu frühem Abschied vom Verbrenner,2021-06-20
Kurssturz der Kryptowährung: Bitcoin-Kurs fällt weiter - Cyberattacken belasten,2021-06-20
Sommerspiele in Tokio: Japan erlaubt bis zu 10.000 Fans in Olympia-Wettkampfstätten,2021-06-21
Weniger Zuwanderung: Bevölkerung wächst erstmals seit fast zehn Jahren nicht mehr,2021-06-21
"Wahlen in Äthiopien: Der Friedensnobelpreisträger, der zum Kriegsherren wurde",2021-06-21
"Risse in Salzbachtalbrücke entdeckt: Brückensperrung, Gleise dicht – Verkehrsprobleme im Raum Wiesbaden",2021-06-21
Nervennahrung: Heute gibt es Rote-Bete-Suppe aus Litauen,2021-06-21
"Der Friedensnobelpreisträger, der zum Kriegsherren wurde",2021-06-21
Union will Wahlpläne aus Wirtschaftswachstum finanzieren,2021-06-21
Bevölkerung wächst erstmals seit fast zehn Jahren nicht mehr,2021-06-21
Olympia-Organisatoren wollen bis zu 10.000 japanische Zuschauer zulassen,2021-06-21
"Der Nazi-Anwalt, der in Untersuchungshaft sitzt",2021-06-21
Tsitsi Dangarembga erhält Friedenspreis des Deutschen Buchhandels,2021-06-21
Wenn der »Tagesschau«-Sprecher aus der Rolle fällt,2021-06-21
Starkregen und Unwetter folgen auf Hitzewelle,2021-06-21
Zwei Leichen in Mündungsarm des Rhein entdeckt,2021-06-21
So heißen Usain Bolts neugeborene Zwillinge,2021-06-21
"Der deutsche Wunsch, ein Däne zu sein",2021-06-21
ZDF-Reporterin bekam jedes Jahr Tausende Euro weniger als ihre Kollegen,2021-06-21
Soll ich meinen Job wechseln – in diesen unsicheren Zeiten?,2021-06-21
Heute gibt es Rote-Bete-Suppe aus Litauen,2021-06-21
Repressionen durch Peking: Prodemokratische Zeitung »Apple Daily« in Hongkong steht vor dem Aus,2021-06-21
Neuseeland: Gewichtheberin Laurel Hubbard tritt als erste Transperson bei Olympia an,2021-06-21
Schwarz Gruppe: Lidl-Boss Klaus Gehrig muss um seinen Job bangen,2021-06-21
Kurssturz der Kryptowährung: Bitcoin-Kurs stürzt weiter - Cyberattacken belasten,2021-06-21
Satellitenbild der Woche: Die zerstörerischen Machenschaften der Goldschürfer,2021-06-21
"Minibeamer von Asus, BenQ, ViewSonic und Anker im Test: So machen Sie jeden Ort zum smarten Kino",2021-06-21
Schwedische Regierung durch Misstrauensvotum gestürzt,2021-06-21
Lapid will als erster israelischer Außenminister die Emirate besuchen,2021-06-21
Forscher fordern psychisches Frühwarnsystem für Kinder und Jugendliche,2021-06-21
"Brückensperrung, Gleise dicht – Verkehrsprobleme im Raum Wiesbaden",2021-06-21
"Die Lage am Morgen: Warum es beschämend ist, Steuererhöhungen auszuschließen",2021-06-21
Ludwigslust-Parchim: Vermisster 70-Jähriger nach zwei Tagen lebend im Wald gefunden,2021-06-21
Formel-1-Pressetimmen zum GP von Frankreich: »Die Formel Max flößt Hamilton Angst ein«,2021-06-21
Steuerpolitik: Union will Wahlpläne aus Wirtschaftswachstum finanzieren,2021-06-21
Europas wertvollstes Start-up: Wie Klarna als Banken-Schreck weiter wachsen will,2021-06-21
»Die Formel Max flößt Hamilton Angst ein«,2021-06-21
Vermisster 70-Jähriger nach zwei Tagen lebend im Wald gefunden,2021-06-21
Der lange Weg zur Gerechtigkeit,2021-06-21
Vorwurf der Spionage: Russischer Mitarbeiter einer deutschen Universität in U-Haft,2021-06-21
Wetterlage zum Wochenbeginn: Starkregen und Unwetter folgen auf Hitzewelle,2021-06-21
Donnerwetter: So heißen Usain Bolts neugeborene Zwillinge,2021-06-21
Rat vom Karrierecoach: Soll ich meinen Job wechseln – in diesen unsicheren Zeiten?,2021-06-21
+++ Livestream +++: Laschet und Söder stellen Unions-Wahlprogramm vor,2021-06-21
Smart Home: Stromversorger in Texas drosseln Klimaanlagen aus der Ferne,2021-06-21
Laut RWI-Studie: Abschaffung des Ehegattensplittings könnte Hunderttausende in Jobs bringen,2021-06-21
Fußball-Europameisterschaft 2021: Positiver Corona-Test – Schottland-Jungstar Gilmour droht EM-Aus,2021-06-21
Nach neuem Wettbewerbsrecht: Bundeskartellamt leitet Verfahren gegen Apple ein,2021-06-21
»Sie wollen Orbán nicht brüskieren«,2021-06-21
Russischer Mitarbeiter einer deutschen Universität in U-Haft,2021-06-21
Trotz Verbot reisen Schaulustige zur Sonnenwende-Feier nach Stonehenge,2021-06-21
Bundeskartellamt leitet Verfahren gegen Apple ein,2021-06-21
Positiver Corona-Test – Schottland-Jungstar Gilmour droht EM-Aus,2021-06-21
Der künftige König läuft und läuft und läuft,2021-06-21
Naher Osten: Lapid will als erster israelischer Außenminister die Emirate besuchen,2021-06-21
Studienfinanzierung und Corona: Bundesregierung will beim Bafög erst einmal abwarten,2021-06-21
Staat mischt kräftig mit: Die wichtigsten Geldgeber deutscher Start-ups,2021-06-21
Nach extremem Hitzewochenende: Warum Deutschland beim Wetter gerade geteilt ist,2021-06-21
Italien: Tödliches Bootsunglück auf dem Gardasee – Polizei ermittelt gegen zwei Deutsche,2021-06-21
Bushidos Ehefrau: Anna-Maria Ferchichi wirft Abou-Chaker »völlige Überwachung« vor,2021-06-21
Laschet und Söder stellen Unions-Wahlprogramm vor,2021-06-21
Spaniens Premier: Katalanische Separatisten sollen am Dienstag begnadigt werden,2021-06-21
Pressekonferenz: Laschet und Söder stellen Unions-Wahlprogramm vor,2021-06-21
Union will Deutschland zum »klimaneutralen Industrieland« umbauen,2021-06-21
Übernimmt Stefan Hartung?: Bosch-Chef Volkmar Denner tritt Ende 2021 ab,2021-06-21
Termin-App: Doctolib übermittelte Informationen zur Arztsuche an Facebook,2021-06-21
Öffentlich-rechtlicher Rundfunk: ARD und ZDF schließen ihre Mediatheken zusammen,2021-06-21
Drei Modell-Diskotheken dürfen im Norden ohne Maskenpflicht öffnen,2021-06-21
Katalanische Separatisten sollen am Dienstag begnadigt werden,2021-06-21
ARD und ZDF schließen ihre Mediatheken zusammen,2021-06-21
"Fußball-EM 2021: Tränen bei Pandev, erneuter Offensivwirbel bei Oranje",2021-06-21
Fußball-EM: Eine Ecke reicht Österreich gegen die Ukraine zum Einzug ins Achtelfinale,2021-06-21
"Umweltprämie mal anders: 1100 Euro pro Jahr, wenn Sie Ihr Auto abschaffen",2021-06-21
Wahl von Ebrahim Raisi: Was von Irans künftiger Regierung zu erwarten ist,2021-06-21
Pakistan: Mufti soll Studenten missbraucht haben,2021-06-21
"1100 Euro pro Jahr, wenn Sie Ihr Auto abschaffen",2021-06-21
Klingt wie: fünfte Amtszeit für Merkel,2021-06-21
»Ökonomisch völlig aus der Zeit gefallen«,2021-06-21
»Die CDU will in die Zeit vor Corona zurück«,2021-06-21
Können Rocker nicht rechnen?,2021-06-21
Der Unverzichtbare,2021-06-21
Ungarn erzürnt über Plan für Regenbogen-Stadion in München,2021-06-21
Die Spiele der Scheinheiligen,2021-06-21
Söder schlägt München als Standort für weitere EM-Spiele vor,2021-06-21
»Die Uefa spielt mit dem Leben von Menschen«,2021-06-21
Abschaffung des Ehegattensplittings könnte Hunderttausende in Jobs bringen,2021-06-21
Linkenabgeordnete Özdemir widerspricht Innenministerium,2021-06-21
Politiker warnen vor Delta-Welle,2021-06-21
Warum die Delta-Variante so gefährlich ist,2021-06-21
"Eine nichtssagende Powerpoint-Präsentation, und schon fließen die Milliarden",2021-06-21
Abu Dhabi bietet kostenlose Corona-Impfungen für Touristen an,2021-06-21
Wie sinnvoll ist die CO₂-Entfernung aus der Atmosphäre?,2021-06-21
Hafenstau in China – Reederei erwartet weltweite Nachwirkungen,2021-06-21
China schließt Bitcoin-Minen im Südwesten,2021-06-21
Was von Irans künftiger Regierung zu erwarten ist,2021-06-21
"»Mein Mann ist eigentlich sehr dominant, aber was Arafat betraf, war er devot«",2021-06-21
"Frau erschießt ihren Vergewaltiger, Petition fordert Freispruch",2021-06-21
Augsburg verschärft Alkoholverbot,2021-06-21
»Mein Körper zeigt mir seit acht Monaten verrückte Signale«,2021-06-21
Tasmanische Teufel töten Tausende Pinguine auf australischer Insel,2021-06-21
Die sprießende Liebe der Gärtner zum Sichtschutzzaun,2021-06-21
Neue deutsche Weicheier,2021-06-21
Abschlussbericht: Untersuchungsausschuss im Fall Amri benennt eklatante Missstände bei Berliner Polizei,2021-06-21
Wahlprogramm von CDU und CSU: Union will Deutschland zum »klimaneutralen Industrieland« umbauen,2021-06-21
"Parlamentswahl in Armenien: Krieg verloren, Wahl gewonnen",2021-06-21
Emirstochter aus Dubai: Foto auf Instagram soll Prinzessin Latifa in Spanien zeigen,2021-06-21
Nach Beginn der Waffenruhe: Israel erlaubt wieder Export landwirtschaftlicher Produkte aus Gaza,2021-06-21
Zwei Verletzte in Sachsen-Anhalt: Schüsse aus Paintball-Waffe – Polizei sucht nach Tatverdächtigem mit Ku-Klux-Klan-Haube,2021-06-21
Bildungspolitik: Streit über die richtige Schulstrategie nach den Sommerferien,2021-06-21
"Leon Goretzka zur Debatte über Regenbogenfarben bei der EM: »Ich bin froh über jedes Zeichen, das gesetzt wird«",2021-06-21
Mögliche Zinsnachzahlung: Banken müssen unwirksame Klauseln in Prämiensparverträgen offenlegen,2021-06-21
Nach Kampagne gegen Baerbock: Aktivisten greifen Moses-Motiv gegen Laschet auf,2021-06-21
Steuer- und Ausgabenvorschläge der Union: Mut zur großen Finanzierungslücke,2021-06-21
Übernahme aus Insolvenz: Logistiker erhält Zuschlag für Adler Modemärkte,2021-06-21
Kurssturz der Kryptowährung: Bitcoin stürzt weiter ab,2021-06-21
Verblüffend simples Gerät: Spezial-Trinkhalm soll gegen Schluckauf helfen,2021-06-21
Vivo X60 Pro im Test: Das Zeiss ist heiß,2021-06-21
Gefährliche Sicherheitslücke entdeckt: Chrome-Nutzer sollten ihren Browser aktualisieren,2021-06-21
"Emotionserkennung: Bitte lächeln, das ist ein Befehl",2021-06-21
Mit Polizeifotos in die Kunstgalerien: Fotograf Arnold Odermatt ist tot,2021-06-21
Gendergerechte Sprache: Nachrichtenagenturen wollen generisches Maskulinum vermeiden,2021-06-21
ZDF-Journalistin Meier und ihr Kampf um faire Bezahlung: Der lange Weg zur Gerechtigkeit,2021-06-21
»Summertime« – ein Song und seine Geschichte: Dänen pfiffen es im Widerstand,2021-06-21
Wendemanöver,2021-06-21
Wahlprogramm der Union: Valium fürs Volk,2021-06-21
"Griechenland verschärft Migrationspolitik: »Ich habe das Gefühl, in einem Gefängnis zu sein«",2021-06-21
Schrottreife Elektro-Tretroller: Unterwasserdrohnen sollen E-Scooter aus dem Rhein bergen,2021-06-21
Nutzte jemand sein Insiderwissen?: Finanzaufsicht prüft Absturz der Curevac-Aktie,2021-06-21
"+++ Fußball-Transferticker +++: Çalhanoğlu bestätigt Wechsel von Milan zu Inter, González geht wohl nach Italien",2021-06-21
Valium fürs Volk,2021-06-21
Mit Brummschädel ins Achtelfinale,2021-06-21
"Tränen bei Pandev, erneuter Offensivwirbel bei Oranje",2021-06-21
Finanzaufsicht prüft Absturz der Curevac-Aktie,2021-06-21
Erdoğan irritiert mit Äußerung über Musik-Sperrstunde,2021-06-21
Unterwasserdrohnen sollen E-Scooter aus dem Rhein bergen,2021-06-21
"»Ich habe das Gefühl, in einem Gefängnis zu sein«",2021-06-21
Jeden Tag mit dem Wingsuit nach Hause,2021-06-21
Welcher dieser vier Alterungstypen sind Sie?,2021-06-21
"Der deutsche Arzt, dem die Italiener vertrauen",2021-06-21
So ist Joggen doch gut fürs Knie,2021-06-21
Trotz aktueller Entspannung: Politiker warnen vor Delta-Welle,2021-06-21
Verhinderte Ausreise: Linkenabgeordnete Özdemir widerspricht Innenministerium,2021-06-21
Die Lage am Abend: Können Rocker nicht rechnen?,2021-06-21
Nach Krawallen in der Innenstadt: Augsburg verschärft Alkoholverbot,2021-06-21
Delta-Variante in Großbritannien: Söder schlägt München als Standort für weitere EM-Spiele vor,2021-06-21
Coronaausbruch in Yantian: Hafenstau in China – Reederei erwartet weltweite Nachwirkungen,2021-06-21
»Sie haben alles dichtgemacht«: China schließt Bitcoin-Minen im Südwesten,2021-06-21
Finanzmarktprognose 2021: Im Herbst wird es brenzlig an der Börse,2021-06-21
Fußball-EM: Eigentor und Lukaku – Belgien macht den Gruppensieg klar,2021-06-21
Sieg gegen Russland bei der Fußball-EM: Dänemark spielt sich in einen Rausch und steht im Achtelfinale,2021-06-21
Baerbock kritisiert Grünen-Liste im Saarland,2021-06-21
Dänemark spielt sich in einen Rausch und steht im Achtelfinale,2021-06-21
Eigentor und Lukaku – Belgien macht den Gruppensieg klar,2021-06-21
Trotz Niederlage gegen Belgien: Die Finnen dürfen noch ein wenig träumen,2021-06-21
Die Finnen dürfen noch ein wenig träumen,2021-06-21
Philippinischer Präsident droht Impfverweigerern mit Gefängnis,2021-06-21
"Misstrauensvotum in Stockholm: Die Mietpreis-Kämpferin, die Schwedens Regierung stürzte",2021-06-21
Mann auf Platz eins: Baerbock kritisiert Grünen-Liste im Saarland,2021-06-21
"Die Mietpreis-Kämpferin, die Schwedens Regierung stürzte",2021-06-21
Grünen-Haushaltspolitiker über Europapläne der Union: »Die CDU will in die Zeit vor Corona zurück«,2021-06-21
Konstellation um Gruppendritte: Fünf weitere Teams fürs EM-Achtelfinale qualifiziert,2021-06-21
Fünf weitere Teams fürs EM-Achtelfinale qualifiziert,2021-06-21
"Fußball-EM: Tränen bei Pandev, erneuter Offensivwirbel bei Oranje",2021-06-21
Dänemark bei Fußball-EM im Achtelfinale: Wie im Traum,2021-06-21
Trotz Niederlage gegen Belgien: Die Finnen dürfen noch ein wenig hoffen,2021-06-21
Wie im Traum,2021-06-21
Die Finnen dürfen noch ein wenig hoffen,2021-06-21
Weshalb Glücksspielfirmen unsere Kicker finanzieren,2021-06-21
Die Generation Corona wird eingeschult – aber ist sie dafür bereit?,2021-06-21
Warum 1000 Schweizer 2000 Unterhosen vergruben,2021-06-21
"Die 26-jährige Suu hatte einen Bürojob, jetzt trainiert sie mit Sprengstoff",2021-06-21
Wie viele Tampons braucht man für eine Weltraummission?,2021-06-21
Nach Ryanair-Vorfall: EU verhängt Sanktionen gegen Verteidigungsminister von Belarus,2021-06-21
Starnberg in Bayern: 13-Jähriger stirbt bei Ruderunfall – Betreuer vor Gericht,2021-06-21
Bedrohte Tierart bedroht Tierart: Tasmanische Teufel töten Tausende Pinguine auf australischer Insel,2021-06-21
"NFL-Profi Carl Nassib: »Was geht Leute, ich wollte nur kurz sagen, dass ich schwul bin«",2021-06-21
"»Was geht Leute, ich wollte nur kurz sagen, dass ich schwul bin«",2021-06-21
Hochansteckende Virus-Mutante: Ärztekammer warnt vor Reisen in Delta-Gebiete,2021-06-21
Ärztekammer warnt vor Reisen in Delta-Gebiete,2021-06-21
Laut Enthüllungsbuch: Trump wollte infizierte US-Bürger nach Guantánamo schicken,2021-06-21
Trump wollte infizierte US-Bürger nach Guantánamo schicken,2021-06-21
Weltweite Lage: Uno sieht »weitreichendste« Rückschläge bei Menschenrechten »zu unseren Lebzeiten«,2021-06-21
Uno sieht »weitreichendste« Rückschläge bei Menschenrechten »zu unseren Lebzeiten«,2021-06-21
"+++ Corona-News +++: RKI meldet 455 Neuinfektionen, Sieben-Tage-Inzidenz sinkt",2021-06-21
Autogramm: Mercedes C-Klasse: Sie kennen mich,2021-06-21
Ehemaliger US-Präsident: Trump startet seine Rache-Tour,2021-06-21
