Teaser,Date
Kabinett billigt Haushaltspläne für 2022 – und Klimaschutz-Sofortprogramm,2021-06-23
Italien: Kleinkind geht nachts allein auf Gebirgstour – Rettung nach zwei Tagen,2021-06-23
"IPCC-Berichtsentwurf: Weltklimarat warnt vor »irreversiblen« Folgen bei Erderwärmung von über 1,5 Grad",2021-06-23
"Neues Lorde-Album in ungewöhnlichem Format: Das ist keine CD, das ist eine Music-Box",2021-06-23
Extremwetterereignisse: USA stehen vor nie dagewesener Hitzewelle,2021-06-23
Letzte Regierungsbefragung der Kanzlerin: »Vorbei ist die Pandemie noch nicht«,2021-06-23
Ursula von der Leyen: »Das ungarische Gesetz ist eine Schande«,2021-06-23
"Chuck Schumer im US-Senat: Erst das Flehen, dann der Angriff",2021-06-23
Nach über 300 Jahren: Rembrandts »Nachtwache« wieder vollständig,2021-06-23
»Vorbei ist die Pandemie noch nicht«,2021-06-23
»Das ungarische Gesetz ist eine Schande«,2021-06-23
Uefa färbt eigenes Logo in Regenbogenfarben,2021-06-23
"Erst das Flehen, dann der Angriff",2021-06-23
Erster Landkreis ist komplett coronafrei,2021-06-23
Hacker stoßen erneut auf Sicherheitslücken bei Corona-Testzentren,2021-06-23
Kleinkind geht nachts allein auf Gebirgstour – Rettung nach zwei Tagen,2021-06-23
Bundeswehr-Skandal in Litauen: Kramp-Karrenbauer stellt Panzergrenadierzug komplett neu auf,2021-06-23
Stiftung Warentest: Fahrradhelm für 45 Euro schützt bei Crashs am besten,2021-06-23
